<?xml version="1.0" encoding="UTF-8"?>
<xs:schema xmlns:xs="http://www.w3.org/2001/XMLSchema">
    <xs:element name="museos">
        <xs:complexType>
            <xs:sequence>
                <xs:element name="museo" maxOccurs="unbounded">
                    <xs:complexType>
                        <xs:sequence>
                            <xs:element name="nombre">
                                <xs:simpleType>
                                    <xs:restriction base="xs:string"></xs:restriction>
                                </xs:simpleType>
                            </xs:element>
                            <xs:element name="ciudad">
                                <xs:simpleType>
                                    <xs:restriction base="xs:string"></xs:restriction>
                                </xs:simpleType>
                            </xs:element>
                            <xs:element name="pais">
                                <xs:simpleType>
                                    <xs:restriction base="xs:string"></xs:restriction>
                                </xs:simpleType>
                            </xs:element>
                        </xs:sequence>
                    </xs:complexType>
                </xs:element>
            </xs:sequence>
        </xs:complexType>
    </xs:element>
</xs:schema>