<?xml version="1.0" encoding="UTF-8"?>
<museos xmlns:xsi="http://www.w3.org/2001/XMLSchema-instance" 
xsi:noNamespaceSchemaLocation="XSD/Museos.xsd">
  <museo>
    <nombre>Museo del Prado</nombre>
    <ciudad>Madrid</ciudad>
    <pais>Espa√±a</pais>
  </museo>
  <museo>
    <nombre>British Museum</nombre>
    <ciudad>Londres</ciudad>
    <pais>Reino Unido</pais>
  </museo>
  <museo>
    <nombre>National Gallery</nombre>
    <ciudad>Londres</ciudad>
    <pais>Reino Unido</pais>
  </museo>
</museos>